19:00:34.120457 eth0  In  IP (tos 0x0, ttl 62, id 22405, offset 0, flags [DF], proto UDP (17), length 531)
    kube-dns.kube-system.svc.cluster.local.53 > nginx-5db77f8f67-9cccp.42449: [udp sum ok] 59363| q: A? www.googleapis.com. 16/4/6 www.googleapis.com. [30s] A 216.58.212.138, www.googleapis.com. [30s] A 172.217.16.202, www.googleapis.com. [30s] A 142.250.186.42, www.googleapis.com. [30s] A 142.250.186.170, www.googleapis.com. [30s] A 216.58.212.170, www.googleapis.com. [30s] A 142.250.186.138, www.googleapis.com. [30s] A 172.217.18.106, www.googleapis.com. [30s] A 142.250.185.202, www.googleapis.com. [30s] A 142.250.184.202, www.googleapis.com. [30s] A 142.250.185.138, www.googleapis.com. [30s] A 142.250.74.202, www.googleapis.com. [30s] A 172.217.18.10, www.googleapis.com. [30s] A 142.250.186.106, www.googleapis.com. [30s] A 142.250.184.234, www.googleapis.com. [30s] A 142.250.185.234, www.googleapis.com. [30s] A 142.250.186.74 ns: googleapis.com. [30s] NS ns3.google.com., googleapis.com. [30s] NS ns2.google.com., googleapis.com. [30s] NS ns4.google.com., googleapis.com. [30s] NS ns1.google.com. ar: ns3.google.com. [30s] A 216.239.36.10, ns1.google.com. [30s] AAAA 2001:4860:4802:32::a, ns4.google.com. [30s] A 216.239.38.10, ns2.google.com. [30s] A 216.239.34.10, ns2.google.com. [30s] AAAA 2001:4860:4802:34::a, ns4.google.com. [30s] AAAA 2001:4860:4802:38::a (503)
19:00:34.120590 eth0  Out IP (tos 0x0, ttl 64, id 26746, offset 0, flags [DF], proto TCP (6), length 60)
    nginx-5db77f8f67-9cccp.34324 > kube-dns.kube-system.svc.cluster.local.53: Flags [S], cksum 0xebf2 (incorrect -> 0xc7f8), seq 1694019668, win 28800, options [mss 1440,sackOK,TS val 3699354560 ecr 0,nop,wscale 7], length 0
19:00:34.120657 eth0  In  IP (tos 0x0, ttl 63, id 0, offset 0, flags [DF], proto TCP (6), length 60)
    kube-dns.kube-system.svc.cluster.local.53 > nginx-5db77f8f67-9cccp.34324: Flags [S.], cksum 0xebf2 (incorrect -> 0xa64d), seq 1206298139, ack 1694019669, win 28560, options [mss 1440,sackOK,TS val 1573312193 ecr 3699354560,nop,wscale 7], length 0
19:00:34.120664 eth0  Out IP (tos 0x0, ttl 64, id 26747, offset 0, flags [DF], proto TCP (6), length 52)
    nginx-5db77f8f67-9cccp.34324 > kube-dns.kube-system.svc.cluster.local.53: Flags [.], cksum 0xebea (incorrect -> 0x43b5), seq 1, ack 1, win 225, options [nop,nop,TS val 3699354560 ecr 1573312193], length 0
19:00:34.120686 eth0  Out IP (tos 0x0, ttl 64, id 26748, offset 0, flags [DF], proto TCP (6), length 90)
    nginx-5db77f8f67-9cccp.34324 > kube-dns.kube-system.svc.cluster.local.53: Flags [P.], cksum 0xec10 (incorrect -> 0xe50c), seq 1:39, ack 1, win 225, options [nop,nop,TS val 3699354560 ecr 1573312193], length 38 59363+ A? www.googleapis.com. (36)
19:00:34.120695 eth0  In  IP (tos 0x0, ttl 63, id 17526, offset 0, flags [DF], proto TCP (6), length 52)
    kube-dns.kube-system.svc.cluster.local.53 > nginx-5db77f8f67-9cccp.34324: Flags [.], cksum 0xebea (incorrect -> 0x4390), seq 1, ack 39, win 224, options [nop,nop,TS val 1573312193 ecr 3699354560], length 0
19:00:39.123103 eth0  In  IP (tos 0x0, ttl 63, id 17527, offset 0, flags [DF], proto TCP (6), length 90)
    kube-dns.kube-system.svc.cluster.local.53 > nginx-5db77f8f67-9cccp.34324: Flags [P.], cksum 0xec10 (incorrect -> 0x515b), seq 1:39, ack 39, win 224, options [nop,nop,TS val 1573317195 ecr 3699354560], length 38 59363 ServFail- q: A? www.googleapis.com. 0/0/0 (36)
19:00:39.123117 eth0  Out IP (tos 0x0, ttl 64, id 26749, offset 0, flags [DF], proto TCP (6), length 52)
    nginx-5db77f8f67-9cccp.34324 > kube-dns.kube-system.svc.cluster.local.53: Flags [.], cksum 0xebea (incorrect -> 0x1c55), seq 39, ack 39, win 225, options [nop,nop,TS val 3699359562 ecr 1573317195], length 0
19:00:39.123604 eth0  Out IP (tos 0x0, ttl 64, id 26750, offset 0, flags [DF], proto TCP (6), length 52)
    nginx-5db77f8f67-9cccp.34324 > kube-dns.kube-system.svc.cluster.local.53: Flags [F.], cksum 0xebea (incorrect -> 0x1c53), seq 39, ack 39, win 225, options [nop,nop,TS val 3699359563 ecr 1573317195], length 0
19:00:39.124208 eth0  In  IP (tos 0x0, ttl 63, id 17528, offset 0, flags [DF], proto TCP (6), length 52)
    kube-dns.kube-system.svc.cluster.local.53 > nginx-5db77f8f67-9cccp.34324: Flags [F.], cksum 0xebea (incorrect -> 0x1c51), seq 39, ack 40, win 224, options [nop,nop,TS val 1573317197 ecr 3699359563], length 0
19:00:39.124216 eth0  Out IP (tos 0x0, ttl 64, id 26751, offset 0, flags [DF], proto TCP (6), length 52)
    nginx-5db77f8f67-9cccp.34324 > kube-dns.kube-system.svc.cluster.local.53: Flags [.], cksum 0xebea (incorrect -> 0x1c4f), seq 40, ack 40, win 225, options [nop,nop,TS val 3699359564 ecr 1573317197], length 0
